name,description,genre
lfi-fuzzploit,"A simple tool to help in the fuzzing for, finding, and exploiting of local file inclusion vulnerabilities in Linux-based PHP applications.",webapp
lfi-image-helper,A simple script to infect images with PHP Backdoors for local file inclusion attacks.,webapp
lfi-scanner,This is a simple perl script that enumerates local file inclusion attempts when given a specific target.,scanner
lfi-sploiter,"This tool helps you exploit LFI (Local File Inclusion) vulnerabilities. Post discovery, simply pass the affected URL and vulnerable parameter to this tool. You can also use this tool to scan a URL for LFI vulnerabilities.",webapp
lfifreak,A unique automated LFi Exploiter with Bind/Reverse Shells.,webapp
lfimap,This script is used to take the highest beneficts of the local file include vulnerability in a webserver.,webapp
lfisuite,Totally Automatic LFI Exploiter (+ Reverse Shell) and Scanner.,scanner
lfle,Recover event log entries from an image by heurisitically looking for record structures.,forensic
lft,A layer four traceroute implementing numerous other features.,recon
lhf,A modular recon tool for pentesting.,recon
libbde,A library to access the BitLocker Drive Encryption (BDE) format.,crypto
libc-database,Database of libc offsets to simplify exploitation.,reversing
libdisasm,A disassembler library.,disassembler
libfvde,Library and tools to access FileVault Drive Encryption (FVDE) encrypted volumes.,forensic
libosmocore,Collection of common code used in various sub-projects inside the Osmocom family of projects.,radio
libparistraceroute,"A library written in C dedicated to active network measurements with examples, such as paris-ping and paris-traceroute.",networking
libpst,Outlook .pst file converter,misc
libtins,"High-level, multiplatform C++ network packet sniffing and crafting library.",networking
lief,Library to Instrument Executable Formats.,disassembler
liffy,A Local File Inclusion Exploitation tool.,webapp
lightbulb,Python framework for auditing web applications firewalls.,webapp
limeaide,Remotely dump RAM of a Linux client and create a volatility profile for later analysis on your local host.,forensic
limelighter,A tool for generating fake code signing certificates or signing real ones.,exploitation
linenum,Scripted Local Linux Enumeration & Privilege Escalation Checks,scanner
linikatz,Tool to attack AD on UNIX.,automation
linkedin2username,OSINT Tool: Generate username lists for companies on LinkedIn.,social
linkfinder,Discovers endpoint and their parameters in JavaScript files.,webapp
linset,Evil Twin Attack Bash script - An automated WPA/WPA2 hacker.,automation
linux-exploit-suggester,A Perl script that tries to suggest exploits based OS version number.,recon
linux-exploit-suggester.sh,Linux privilege escalation auditing tool.,recon
linux-inject,Tool for injecting a shared object into a Linux process.,backdoor
linux-smart-enumeration,Linux enumeration tool for pentesting and CTFs with verbosity levels.,scanner
lisa.py,An Exploit Dev Swiss Army Knife.,exploitation
list-urls,Extracts links from webpage.,webapp
littleblackbox,"Penetration testing tool, search in a collection of thousands of private SSL keys extracted from various embedded devices.",scanner
littlebrother,"OSINT tool to get informations on French, Belgian and Swizerland people.",recon
lldb,"Next generation, high-performance debugger",debugger
loadlibrary,Porting Windows Dynamic Link Libraries to Linux.,binary
locasploit,Local enumeration and exploitation framework.,scanner
lodowep,Lodowep is a tool for analyzing password strength of accounts on a Lotus Domino webserver system.,cracker
log-file-parser,Parser for $LogFile on NTFS.,forensic
logkeys,A GNU/Linux keylogger that worked.,keylogger
loic,An open source network stress tool for Windows.,networking
loki-scanner,Simple IOC and Incident Response Scanner.,forensic
lolbas,Living Off The Land Binaries And Scripts - (LOLBins and LOLScripts).,windows
loot,Sensitive information extraction tool.,recon
lorcon,Generic library for injecting 802.11 frames,wireless
lorg,Apache Logfile Security Analyzer.,defensive
lotophagi,a relatively compact Perl script designed to scan remote hosts for default (or common) Lotus NSF and BOX databases.,scanner
lsrtunnel,Spoofs connections using source routed packets.,spoof
lte-cell-scanner,"LTE SDR cell scanner optimized to work with very low performance RF front ends (8bit A/D, 20dB noise figure).",scanner
ltrace,Tracks runtime library calls in dynamically linked programs,binary
luksipc,A tool to convert unencrypted block devices to encrypted LUKS devices in-place.,crypto
lulzbuster,A very fast and smart web directory and file enumeration tool written in C.,webapp
lunar,A UNIX security auditing tool based on several security frameworks.,scanner
luyten,An Open Source Java Decompiler Gui for Procyon.,decompiler
lynis,Security and system auditing tool to harden Unix/Linux systems,scanner
lyricpass,Tool to generate wordlists based on lyrics.,automation
m3-gen,"Generates Malicious Macro and Execute Powershell or Shellcode via MSBuild Application Whitelisting Bypass, this tool intended for adversary simulation and red teaming purpose.",exploitation
mac-robber,A digital investigation tool that collects data from allocated files in a mounted file system.,forensic
macchanger,A small utility to change your NIC's MAC address,networking
machinae,A tool for collecting intelligence from public sites/feeds about various security-related pieces of data.,recon
maclookup,Lookup MAC addresses in the IEEE MA-L/OUI public listing.,networking
magescan,Scan a Magento site for information.,webapp
magicrescue,Find and recover deleted files on block devices,forensic
magictree,"A penetration tester productivity tool designed to allow easy and straightforward data consolidation, querying, external command execution and report generation",misc
mail-crawl,Tool to harvest emails from website.,recon
make-pdf,This tool will embed javascript inside a PDF document.,forensic
maketh,"A packet generator that supports forging ARP, IP, TCP, UDP, ICMP and the ethernet header as well.",networking
malboxes,Builds malware analysis Windows VMs so that you don't have to.,blackarch-malwar
malcom,Analyze a system's network communication using graphical representations of network traffic.,networking
malheur,A tool for the automatic analyze of malware behavior.,forensic
malice,VirusTotal Wanna Be - Now with 100% more Hipster.,defensive
maligno,"An open source penetration testing tool written in python, that serves Metasploit payloads. It generates shellcode with msfvenom and transmits it over HTTP or HTTPS.",scanner
mallory,HTTP/HTTPS proxy over SSH.,proxy
malmon,Hosting exploit/backdoor detection daemon.,defensive
malscan,A Simple PE File Heuristics Scanner.,malware
maltego,"An open source intelligence and forensics application, enabling to easily gather information about DNS, domains, IP addresses, websites, persons, etc.",forensic
maltrail,Malicious traffic detection system.,defensive
maltrieve,Originated as a fork of mwcrawler. It retrieves malware directly from the sources as listed at a number of sites.,malware
malware-check-tool,Python script that detects malicious files via checking md5 hashes from an offline set or via the virustotal site. It has http proxy support and an update feature.,malware
malwareanalyser,A freeware tool to perform static and dynamic analysis on malware.,windows
malwaredetect,Submits a file's SHA1 sum to VirusTotal to determine whether it is a known piece of malware,forensic
malwasm,Offline debugger for malware's reverse engineering.,reversing
malybuzz,A Python tool focused in discovering programming faults in network software.,fuzzer
mana,A toolkit for rogue access point (evilAP) attacks first presented at Defcon 22.,wireless
mando.me,Web Command Injection Tool.,webapp
manticore,Symbolic execution tool.,binary
manul,"A coverage-guided parallel fuzzer for open-source and blackbox binaries on Windows, Linux and MacOS.",fuzzer
mara-framework,A Mobile Application Reverse engineering and Analysis Framework.,mobile
marc4dasm,This python-based tool is a disassembler for the Atmel MARC4 (a 4 bit Harvard micro).,disassembler
maryam,Full-featured Web Identification framework written in Python.,scanner
maskprocessor,A High-Performance word generator with a per-position configurable charset.,automation
massbleed,SSL Vulnerability Scanner.,recon
masscan,"TCP port scanner, spews SYN packets asynchronously, scanning entire Internet in under 5 minutes",scanner
masscan-automation,Masscan integrated with Shodan API.,automation
massdns,A high-performance DNS stub resolver in C.,networking
massexpconsole,A collection of tools and exploits with a cli ui for mass exploitation.,automation
mat,"Metadata Anonymisation Toolkit composed of a GUI application, a CLI application and a library.",defensive
mat2,"Metadata removal tool, supporting a wide range of commonly used file formats",defensive
matahari,A reverse HTTP shell to execute commands on remote machines behind firewalls.,tunnel
matroschka,Python steganography tool to hide images or text in images.,stego
mausezahn,A free fast traffic generator written in C which allows you to send nearly every possible and impossible packet.,dos
mbenum,Queries the master browser for whatever information it has registered.,windows
mboxgrep,"A small, non-interactive utility that scans mail folders for messages matching regular expressions. It does matching against basic and extended POSIX regular expressions, and reads and writes a variety of mailbox formats.",forensic
mdbtools,Utilities for viewing data and exporting schema from Microsoft Access Database files.,forensic
mdcrack,MD4/MD5/NTLM1 hash cracker,cracker
mdk3,WLAN penetration tool,wireless
mdk4,Proof-of-Concept tool to exploit common IEEE 802.11 protocol weaknesses.,wireless
mdns-recon,An mDNS recon tool written in Python.,recon
meanalyzer,Intel Engine Firmware Analysis Tool.,firmware
medusa,"Speedy, massively parallel and modular login brute-forcer for network",cracker
meg,Fetch many paths for many hosts - without killing the hosts.,webapp
melkor,"An ELF fuzzer that mutates the existing data in an ELF sample given to create orcs (malformed ELFs), however, it does not change values randomly (dumb fuzzing), instead, it fuzzes certain metadata with semi-valid values through the use of fuzzing rules (knowledge base).",fuzzer
memdump,"Dumps system memory to stdout, skipping over holes in memory maps.",forensic
memfetch,Dumps any userspace process memory without affecting its execution.,forensic
memimager,Performs a memory dump using NtSystemDebugControl.,windows
mentalist,Graphical tool for custom wordlist generation.,automation
merlin-server,Merlin is a cross-platform post-exploitation HTTP/2 Command & Control server and agent written in golang.,automation
metabigor,Intelligence Tool but without API key.,recon
metacoretex,MetaCoretex is an entirely JAVA vulnerability scanning framework for databases.,database
metagoofil,An information gathering tool designed for extracting metadata of public documents.,recon
metame,A simple metamorphic code engine for arbitrary executables.,binary
metasploit,"Advanced open-source platform for developing, testing, and using exploit code",exploitation
metasploit-autopwn,db_autopwn plugin of metasploit.,automation
meterssh,"A way to take shellcode, inject it into memory then tunnel whatever port you want to over SSH to mask any type of communications as a normal SSH connection.",backdoor
metoscan,Tool for scanning the HTTP methods supported by a webserver. It works by testing a URL and checking the responses for the different requests.,webapp
mfcuk,MIFARE Classic Universal toolKit.,wireless
mfoc,MiFare Classic Universal toolKit,cracker
mfsniffer,A python script for capturing unencrypted TSO login credentials.,sniffer
mft2csv,Extract $MFT record info and log it to a csv file.,forensic
mftcarver,Carve $MFT records from a chunk of data (for instance a memory dump).,forensic
mftrcrd,Command line $MFT record decoder.,forensic
mftref2name,Resolve file index number to name or vice versa on NTFS.,forensic
mibble,An open-source SNMP MIB parser (or SMI parser) written in Java. It can be used to read SNMP MIB files as well as simple ASN.1 files.,misc
microsploit,"Fast and easy create backdoor office exploitation using module metasploit packet, Microsoft Office, Open Office, Macro attack, Buffer Overflow.",backdoor
middler,A Man in the Middle tool to demonstrate protocol middling attacks.,networking
mikrotik-npk,Python tools for manipulating Mikrotik NPK format.,reversing
mildew,Dotmil subdomain discovery tool that scrapes domains from official DoD website directories and certificate transparency logs.,recon
mimikatz,A little tool to play with Windows security.,windows
mimipenguin,A tool to dump the login password from the current linux user.,forensic
mingsweeper,"A network reconnaissance tool designed to facilitate large address space,high speed node discovery and identification.",windows
minimodem,"A command-line program which decodes (or generates) audio modem tones at any specified baud rate, using various framing protocols.",misc
minimysqlator,A multi-platform application used to audit web sites in order to discover and exploit SQL injection vulnerabilities.,exploitation
miranda-upnp,"A Python-based Universal Plug-N-Play client application designed to discover, query and interact with UPNP devices",exploitation
missidentify,A program to find Win32 applications.,recon
missionplanner,A GroundControl Station for Ardupilot.,drone
mitm,A simple yet effective python3 script to perform DNS spoofing via ARP poisoning.,networking
mitm-relay,Hackish way to intercept and modify non-HTTP protocols through Burp & others.,proxy
mitm6,Pwning IPv4 via IPv6.,scanner
mitmap,A python program to create a fake AP and sniff data.,wireless
mitmap-old,Shell Script for launching a Fake AP with karma functionality and launches ettercap for packet capture and traffic manipulation.,automation
mitmer,A man-in-the-middle and phishing attack tool that steals the victim's credentials of some web services like Facebook.,sniffer
mitmf,A Framework for Man-In-The-Middle attacks written in Python.,exploitation
mitmproxy,SSL-capable man-in-the-middle HTTP proxy,proxy
mkbrutus,Password bruteforcer for MikroTik devices or boxes running RouterOS.,cracker
mkyara,Tool to generate YARA rules based on binary code.,misc
mobiusft,"An open-source forensic framework written in Python/GTK that manages cases and case items, providing an abstract interface for developing extensions.",forensic
mobsf,"An intelligent, all-in-one open source mobile application (Android/iOS) automated pen-testing framework capable of performing static, dynamic analysis and web API testing.",mobile
modscan,A new tool designed to map a SCADA MODBUS TCP based network.,scanner
moloch,"An open source large scale IPv4 full PCAP capturing, indexing and database system.",networking
mongoaudit,A powerful MongoDB auditing and pentesting tool .,scanner
monocle,"A local network host discovery tool. In passive mode, it will listen for ARP request and reply packets. In active mode, it will send ARP requests to the specific IP range. The results are a list of IP and MAC addresses present on the local network.",recon
monsoon,A fast HTTP enumerator that allows you to execute a large number of HTTP requests.,webapp
mooscan,A scanner for Moodle LMS.,webapp
morpheus,Automated Ettercap TCP/IP Hijacking Tool.,automation
morxbook,A password cracking tool written in perl to perform a dictionary-based attack on a specific Facebook user through HTTPS.,cracker
morxbrute,A customizable HTTP dictionary-based password cracking tool written in Perl.,cracker
morxbtcrack,Single Bitcoin private key cracking tool released.,cracker
morxcoinpwn,Mass Bitcoin private keys brute forcing/Take over tool released.,cracker
morxcrack,A cracking tool written in Perl to perform a dictionary-based attack on various hashing algorithm and CMS salted-passwords.,cracker
morxkeyfmt,Read a private key from stdin and output formatted data values.,crypto
morxtraversal,Path Traversal checking tool.,webapp
morxtunel,Network Tunneling using TUN/TAP interfaces over TCP tool.,tunnel
mosca,Static analysis tool to find bugs like a grep unix command.,code-audit
mosquito,XSS exploitation tool - access victims through HTTP proxy.,exploitation
mots,Man on the Side Attack - experimental packet injection and detection.,sniffer
motsa-dns-spoofing,ManOnTheSideAttack-DNS Spoofing.,spoof
mousejack,Wireless mouse/keyboard attack with replay/transmit poc.,wireless
mp3nema,"A tool aimed at analyzing and capturing data that is hidden between frames in an MP3 file or stream, otherwise noted as ""out of band"" data.",forensic
mptcp,A tool for manipulation of raw packets that allows a large number of options.,networking
mptcp-abuse,A collection of tools and resources to explore MPTCP on your network. Initially released at Black Hat USA 2014.,networking
mrsip,SIP-Based Audit and Attack Tool.,voip
mrtparse,A module to read and analyze the MRT format data.,misc
ms-sys,A tool to write Win9x-.. master boot records (mbr) under linux - RTM!,backdoor
msf-mpc,Msfvenom payload creator.,automation
msfdb,Manage the metasploit framework database.,misc
msfenum,A Metasploit auto auxiliary script.,automation
mssqlscan,A small multi-threaded tool that scans for Microsoft SQL Servers.,scanner
msvpwn,Bypass Windows' authentication via binary patching.,windows
mtr,Combines the functionality of traceroute and ping into one tool (CLI version),networking
mtscan,Mikrotik RouterOS wireless scanner.,wireless
mubeng,An incredibly fast proxy checker & IP rotator with ease.,proxy
multiinjector,Automatic SQL injection utility using a lsit of URI addresses to test parameter manipulation.,webapp
multimac,Multiple MACs on an adapter,spoof
multimon-ng,"An sdr decoder, supports pocsag, ufsk, clipfsk, afsk, hapn, fsk, dtmf, zvei.",radio
multiscanner,Modular file scanning/analysis framework.,scanner
multitun,Tunnel arbitrary traffic through an innocuous WebSocket.,tunnel
munin-hashchecker,Online hash checker for Virustotal and other services,defensive
muraena,Almost-transparent reverse proxy to automate phishing and post-phishing activities.,social
mutator,"This project aims to be a wordlist mutator with hormones, which means that some mutations will be applied to the result of the ones that have been already done, resulting in something like: corporation -> C0rp0r4t10n_2012",automation
mwebfp,Mass Web Fingerprinter.,fingerprint
mxtract,Memory Extractor & Analyzer.,forensic
mybff,A Brute Force Framework.,cracker
myjwt,"This cli is for pentesters, CTF players, or dev. You can modify your jwt, sign, inject, etc.",exploitation
mylg,Network Diagnostic Tool.,networking
mysql2sqlite,Converts a mysqldump file into a Sqlite 3 compatible file.,database
n1qlmap,An N1QL exploitation tool.,exploitation
naabu,A fast port scanner written in go with focus on reliability and simplicity.,scanner
nacker,A tool to circumvent 802.1x Network Access Control on a wired LAN.,networking
naft,Network Appliance Forensic Toolkit.,forensic
nasnum,Script to enumerate network attached storages.,recon
nbname,Decodes and displays all NetBIOS name packets it receives on UDP port 137 and more!,windows
nbnspoof,NetBIOS Name Service Spoofer,spoof
nbtenum,A utility for Windows that can be used to enumerate NetBIOS information from one host or a range of hosts.,windows
nbtool,"Some tools for NetBIOS and DNS investigation, attacks, and communication.",networking
nbtscan,Scan networks for NetBIOS name information.,scanner
ncpfs,Allows you to mount volumes of NetWare servers under Linux.,networking
ncrack,High-speed network authentication cracking tool,cracker
necromant,Python Script that search unused Virtual Hosts in Web Servers.,recon
needle,The iOS Security Testing Framework.,mobile
neglected,Facebook CDN Photo Resolver.,recon
neighbor-cache-fingerprinter,An ARP based Operating System version scanner.,fingerprint
nemesis,A command-line network packet crafting and injection utility.,networking
neo-regeorg,"Improved version of reGeorg, HTTP tunneling pivot tool",tunnel
net-creds,Sniffs sensitive data from interface or pcap.,sniffer
netactview,A graphical network connections viewer similar in functionality to netstat.,networking
netattack,Python script to scan and attack wireless networks.,wireless
netbios-share-scanner,This tool could be used to check windows workstations and servers if they have accessible shared resources.,scanner
netbus,NetBus remote administration tool,windows
netcommander,An easy-to-use arp spoofing tool.,spoof
netcon,A network connection establishment and management script.,networking
netdiscover,"An active/passive address reconnaissance tool, mainly developed for those wireless networks without dhcp server, when you are wardriving. It can be also used on hub/switched networks.",recon
netkit-bsd-finger,BSD-finger ported to Linux.,recon
netkit-rusers,Logged in users; Displays who is logged in to machines on local network.,recon
netkit-rwho,Remote who client and server (with Debian patches).,recon
netmap,Can be used to make a graphical representation of the surrounding network.,networking
netmask,Helps determine network masks,recon
netreconn,A collection of network scan/recon tools that are relatively small compared to their larger cousins.,networking
netripper,Smart traffic sniffing for penetration testers.,windows
netscan,"Tcp/Udp/Tor port scanner with: synpacket, connect TCP/UDP and socks5 (tor connection).",scanner
netscan2,Active / passive network scanner.,scanner
netsed,Small and handful utility design to alter the contents of packets forwarded thru network in real time.,networking
netsniff-ng,High performance Linux network sniffer for packet inspection,sniffer
netstumbler,Well-known wireless AP scanner and sniffer.,windows
network-app-stress-tester,Network Application Stress Testing Yammer.,dos
networkmap,Post-exploitation network mapper.,networking
networkminer,"A Network Forensic Analysis Tool for advanced Network Traffic Analysis, sniffer and packet analyzer.",forensic
netzob,"An open source tool for reverse engineering, traffic generation and fuzzing of communication protocols.",reversing
nextnet,Pivot point discovery tool.,networking
nfcutils,Provides a simple 'lsnfc' command that list tags which are in your NFC device field,nfc
nfdump,A set of tools to collect and process netflow data.,networking
nfex,A tool for extracting files from the network in real-time or post-capture from an offline tcpdump pcap savefile.,forensic
nfspy,A Python library for automating the falsification of NFS credentials when mounting an NFS share.,automation
nfsshell,Userland NFS command tool.,automation
ngrep,A grep-like utility that allows you to search for network packets on an interface.,networking
ngrok,"A tunneling, reverse proxy for developing and understanding networked, HTTP services.",tunnel
nield,"A tool to receive notifications from kernel through netlink socket, and generate logs related to interfaces, neighbor cache(ARP,NDP), IP address(IPv4,IPv6), routing, FIB rules, traffic control.",networking
nikto,A web server scanner which performs comprehensive tests against web servers for multiple items,scanner
nili,"Tool for Network Scan, Man in the Middle, Protocol Reverse Engineering and Fuzzing.",scanner
nimbostratus,Tools for fingerprintinging and exploiting Amazon cloud infrastructures.,fingerprint
nipe,A script to make Tor Network your default gateway.,defensive
nipper,Network Infrastructure Parser,networking
nirsoft,Unique collection of small and useful freeware utilities.,windows
nishang,Using PowerShell for Penetration Testing.,windows
njsscan,A static application testing (SAST) tool that can find insecure code patterns in your node.js applications.,code-audit
nkiller2,A TCP exhaustion/stressing tool.,dos
nmap,Utility for network discovery and security auditing,scanner
nmap-parse-output,Converts/manipulates/extracts data from a nmap scan output.,misc
nmbscan,"Tool to scan the shares of a SMB/NetBIOS network, using the NMB/SMB/NetBIOS protocols.",scanner
nohidy,"The system admins best friend, multi platform auditing tool.",recon
nomorexor,Tool to help guess a files 256 byte XOR key by using frequency analysis.,crypto
noriben,"Portable, Simple, Malware Analysis Sandbox.",malware
nosqlattack,Python tool to automate exploit MongoDB server IP on Internet anddisclose the database data by MongoDB default configuration weaknesses and injection attacks.,automation
nosqli,NoSQL scanner and injector.,webapp
nosqli-user-pass-enum,Script to enumerate usernames and passwords from vulnerable web applications running MongoDB.,exploitation
nosqlmap,Automated Mongo database and NoSQL web application exploitation tool,webapp
notspikefile,A Linux based file format fuzzing tool,fuzzer
novahot,A webshell framework for penetration testers.,webapp
nray,Distributed port scanner.,scanner
nsdtool,A netgear switch discovery tool. It contains some extra features like bruteoforce and setting a new password.,networking
nsearch,Minimal script to help find script into the nse database.,misc
nsec3map,A tool to enumerate the resource records of a DNS zone using its DNSSEC NSEC or NSEC3 chain.,scanner
nsec3walker,Enumerates domain names using DNSSEC,recon
nsia,"A website scanner that monitors websites in realtime in order to detect defacements, compliance violations, exploits, sensitive information disclosure and other issues.",scanner
nsntrace,Perform network trace of a single process by using network namespaces.,sniffer
nsoq,A Network Security Tool for packet manipulation that allows a large number of options.,networking
ntds-decode,This application dumps LM and NTLM hashes from active accounts stored in an Active Directory database.,windows
