name,description,genre
0d1n,"Web security tool to make fuzzing at HTTP inputs, made in C with libCurl.",webapp
0trace,A hop enumeration tool.,scanner
3proxy,Tiny free proxy server.,proxy
3proxy-win32,Tiny free proxy server.,windows
42zip,Recursive Zip archive bomb.,dos
a2sv,Auto Scanning to SSL Vulnerability.,scanner
abcd,ActionScript ByteCode Disassembler.,disassembler
abuse-ssl-bypass-waf,Bypassing WAF by abusing SSL/TLS Ciphers.,webapp
acccheck,A password dictionary attack tool that targets windows authentication via the SMB protocol.,cracker
ace,Automated Corporate Enumerator. A simple yet powerful VoIP Corporate Directory enumeration tool that mimics the behavior of an IP Phone in order to download the name and extension entries that a given phone can display on its screen interface,voip
aclpwn,Active Directory ACL exploitation with BloodHound.,exploitation
activedirectoryenum,Enumerate AD through LDAP.,recon
ad-ldap-enum,An LDAP based Active Directory user and group enumeration tool.,recon
adape-script,Active Directory Assessment and Privilege Escalation Script.,windows
adfind,"Simple admin panel finder for php,js,cgi,asp and aspx admin panels.",webapp
admid-pack,ADM DNS spoofing tools - Uses a variety of active and passive methods to spoof DNS packets. Very powerful.,spoof
adminpagefinder,This python script looks for a large amount of possible administrative interfaces on a given site.,webapp
admsnmp,ADM SNMP audit scanner.,scanner
aesfix,A tool to find AES key in RAM.,cracker
aeskeyfind,A tool to find AES key in RAM.,cracker
aespipe,Reads data from stdin and outputs encrypted or decrypted results to stdout.,crypto
aesshell,A backconnect shell for Windows and Unix written in python and uses AES in CBC mode in conjunction with HMAC-SHA256 for secure transport.,backdoor
afflib,An extensible open format for the storage of disk images and related forensic information.,forensic
aflplusplus,American Fuzzing Lop fuzzer with community patches and additional features.,fuzzer
afpfs-ng,A client for the Apple Filing Protocol (AFP),networking
agafi,A gadget finder and a ROP-Chainer tool for x86 platforms.,windows
against,A very fast ssh attacking script which includes a multithreaded port scanning module (tcp connect) for discovering possible targets and a multithreaded brute-forcing module which attacks parallel all discovered hosts or given ip addresses from a list.,cracker
aggroargs,"Bruteforce commandline buffer overflows, linux, aggressive arguments.",exploitation
aiengine,A packet inspection engine with capabilities of learning without any human intervention.,networking
aimage,A program to create aff-images.,forensic
aiodnsbrute,Python 3 DNS asynchronous brute force utility.,recon
air,A GUI front-end to dd/dc3dd designed for easily creating forensic images.,forensic
aircrack-ng,Key cracker for the 802.11 WEP and WPA-PSK protocols,wireless
airflood,A modification of aireplay that allows for a DoS of the AP. This program fills the table of clients of the AP with random MACs doing impossible new connections. [Tool in Spanish],wireless
airgeddon,Multi-use bash script for Linux systems to audit wireless networks.,wireless
airopy,Get (wireless) clients and access points.,wireless
airoscript,A script to simplify the use of aircrack-ng tools.,wireless
airpwn,A tool for generic packet injection on an 802.11 network.,wireless
ajpfuzzer,A command-line fuzzer for the Apache JServ Protocol (ajp13).,fuzzer
albatar,A SQLi exploitation framework in Python.,webapp
allthevhosts,A vhost discovery tool that scrapes various web applications.,scanner
altdns,"Generates permutations, alterations and mutations of subdomains and then resolves them.",recon
amass,In-depth subdomain enumeration written in Go.,scanner
amber,Reflective PE packer.,binary
amoco,Yet another tool for analysing binaries.,binary
analyzemft,Parse the MFT file from an NTFS filesystem.,forensic
analyzepesig,Analyze digital signature of PE file.,windows
androbugs,An efficient Android vulnerability scanner that helps developers or hackers find potential security vulnerabilities in Android applications.,mobile
androguard,"Reverse engineering, Malware and goodware analysis of Android applications and more.",binary
androick,A python tool to help in forensics analysis on android.,mobile
android-apktool,A tool for reverse engineering Android apk files.,reversing
android-ndk,Android C/C++ developer kit,mobile
android-sdk,Google Android SDK,mobile
android-udev-rules,Android udev rules.,mobile
androidpincrack,Bruteforce the Android Passcode given the hash and salt.,mobile
androidsniffer,"A perl script that lets you search for 3rd party passwords, dump the call log, dump contacts, dump wireless configuration, and more.",mobile
androwarn,Yet another static code analyzer for malicious Android applications.,mobile
angr,The next-generation binary analysis platform from UC Santa Barbaras Seclab.,binary
angr-management,This is the GUI for angr.,binary
angr-py2,The next-generation binary analysis platform from UC Santa Barbaras Seclab.,binary
angrop,A rop gadget finder and chain builder.,exploitation
anontwi,A free software python client designed to navigate anonymously on social networks. It supports Identi.ca and Twitter.com.,social
anti-xss,A XSS vulnerability scanner.,webapp
antiransom,A tool capable of detect and stop attacks of Ransomware using honeypots.,windows
apache-users,This perl script will enumerate the usernames on a unix system that use the apache module UserDir.,scanner
apacket,Sniffer syn and backscatter packets.,networking
aphopper,A program that automatically hops between access points of different wireless networks.,wireless
apkid,"Android Application Identifier for Packers, Protectors, Obfuscators and Oddities.",mobile
apkstat,Automated Information Retrieval From APKs For Initial Analysis.,mobile
apkstudio,An IDE for decompiling/editing & then recompiling of android application binaries.,reversing
apnbf,A small python script designed for enumerating valid APNs (Access Point Name) on a GTP-C speaking device.,wireless
appmon,"A runtime security testing & profiling framework for native apps on macOS, iOS & android and it is built using Frida.",mobile
apt2,Automated penetration toolkit.,automation
aquatone,A Tool for Domain Flyovers.,recon
arachni,"A feature-full, modular, high-performance Ruby framework aimed towards helping penetration testers and administrators evaluate the security of web applications.",webapp
aranea,A fast and clean dns spoofing tool.,spoof
archivebox,"The open source self-hosted web archive. Takes browser history/bookmarks/Pocket/Pinboard/etc., saves HTML, JS, PDFs, media, and more.",misc
arduino,Arduino prototyping platform SDK,hardware
argon2,A password-hashing function (reference C implementation),crypto
argus,Network monitoring tool with flow control.,networking
argus-clients,Network monitoring client for Argus.,networking
arjun,HTTP parameter discovery suite.,webapp
armitage,A graphical cyber attack management tool for Metasploit.,exploitation
armor,A simple Bash script designed to create encrypted macOS payloads capable of evading antivirus scanners.,exploitation
armscgen,ARM Shellcode Generator (Mostly Thumb Mode).,exploitation
arp-scan,A tool that uses ARP to discover and fingerprint IP hosts on the local network,networking
arpalert,Monitor ARP changes in ethernet networks.,networking
arpoison,The UNIX arp cache update utility,exploitation
arpon,"A portable handler daemon that make ARP protocol secure in order to avoid the Man In The Middle (MITM) attack through ARP Spoofing, ARP Cache Poisoning or ARP Poison Routing (APR) attacks.",defensive
arpstraw,Arp spoof detection tool.,defensive
arptools,"A simple tool about ARP broadcast, ARP attack, and data transmission.",networking
arpwner,GUI-based python tool for arp poisoning and dns poisoning attacks.,networking
artillery,"A combination of a honeypot, file-system monitoring, system hardening, and overall health of a server to create a comprehensive way to secure a system.",defensive
artlas,Apache Real Time Logs Analyzer System.,defensive
arybo,"Manipulation, canonicalization and identification of mixed boolean-arithmetic symbolic expressions.",misc
asleap,Actively recover LEAP/PPTP passwords.,cracker
asp-audit,An ASP fingerprinting tool and vulnerability scanner.,fingerprint
assetfinder,Find domains and subdomains potentially related to a given domain.,scanner
astra,Automated Security Testing For REST API's.,webapp
atear,"Wireless Hacking, WiFi Security, Vulnerability Analyzer, Pentestration.",wireless
atftp,"Client/server implementation of the TFTP protocol that implements RFCs 1350, 2090, 2347, 2348, and 2349",networking
athena-ssl-scanner,A SSL cipher scanner that checks all cipher codes. It can identify about 150 different ciphers.,scanner
atlas,Open source tool that can suggest sqlmap tampers to bypass WAF/IDS/IPS.,webapp
atscan,"Server, Site and Dork Scanner.",scanner
atstaketools,"This is an archive of various @Stake tools that help perform vulnerability scanning and analysis, information gathering, password auditing, and forensics.",windows
attacksurfacemapper,Tool that aims to automate the reconnaissance process.,recon
attk,Trend Micro Anti-Threat Toolkit.,scanner
aurebeshjs,Translate JavaScript to Other Alphabets.,misc
auto-eap,Automated Brute-Force Login Attacks Against EAP Networks.,wireless
auto-xor-decryptor,Automatic XOR decryptor tool.,crypto
automato,Should help with automating some of the user-focused enumeration tasks during an internal penetration test.,automation
autonessus,This script communicates with the Nessus API in an attempt to help with automating scans.,automation
autonse,Massive NSE (Nmap Scripting Engine) AutoSploit and AutoScanner.,automation
autopsy,The forensic browser. A GUI for the Sleuth Kit.,forensic
autopwn,Specify targets and run sets of tools against them.,automation
autorecon,A multi-threaded network reconnaissance tool which performs automated enumeration of services.,automation
autosint,Tool to automate common osint tasks.,recon
autosploit,Automate the exploitation of remote hosts.,exploitation
autovpn,Easily connect to a VPN in a country of your choice.,automation
avaloniailspy,.NET Decompiler (port of ILSpy),decompiler
avet,AntiVirus Evasion Tool,binary
avml,A portable volatile memory acquisition tool for Linux.,misc
aws-extender-cli,Script to test S3 buckets as well as Google Storage buckets and Azure Storage containers for common misconfiguration issues.,scanner
aws-inventory,Discover resources created in an AWS account.,recon
awsbucketdump,A tool to quickly enumerate AWS S3 buckets to look for loot.,automation
azazel,A userland rootkit based off of the original LD_PRELOAD technique from Jynx rootkit.,backdoor
aztarna,A footprinting tool for ROS and SROS systems.,recon
backcookie,Small backdoor using cookie.,backdoor
backdoor-apk,Shell script that simplifies the process of adding a backdoor to any Android APK file,mobile
backdoor-factory,Patch win32/64 binaries with shellcode.,backdoor
backdoorme,A powerful utility capable of backdooring Unix machines with a slew of backdoors.,backdoor
backdoorppt,Transform your payload.exe into one fake word doc (.ppt).,backdoor
backfuzz,A network protocol fuzzing toolkit.,fuzzer
backhack,"Tool to perform Android app analysis by backing up and extracting apps, allowing you to analyze and modify file system contents for apps.",mobile
backoori,Tool aided persistence via Windows URI schemes abuse.,exploitation
backorifice,A remote administration system which allows a user to control a computer across a tcpip connection using a simple console or GUI application.,windows
bad-pdf,Steal NTLM Hashes with Bad-PDF.,exploitation
badkarma,Advanced network reconnaissance toolkit.,recon
badministration,A tool which interfaces with management or administration applications from an offensive standpoint.,webapp
bagbak,Yet another frida based App decryptor.,mobile
balbuzard,"A package of malware analysis tools in python to extract patterns of interest from suspicious files (IP addresses, domain names, known file headers, interesting strings, etc).",malware
bamf-framework,A modular framework designed to be a platform to launch attacks against botnets.,malware
bandicoot,A toolbox to analyze mobile phone metadata.,mobile
barf,A multiplatform open source Binary Analysis and Reverse engineering Framework.,binary
barmie,Java RMI enumeration and attack tool.,scanner
barq,An AWS Cloud Post Exploitation framework.,exploitation
base64dump,Extract and decode base64 strings from files.,misc
basedomainname,"Tool that can extract TLD (Top Level Domain), domain extensions (Second Level Domain + TLD), domain name, and hostname from fully qualified domain names.",recon
bashfuscator,Fully configurable and extendable Bash obfuscation framework.,automation
batctl,B.A.T.M.A.N. advanced control and management tool,wireless
batman-adv,"Batman kernel module, (included upstream since .38)",wireless
batman-alfred,Almighty Lightweight Fact Remote Exchange Daemon,wireless
bbqsql,SQL injection exploit tool.,webapp
bbscan,A tiny Batch web vulnerability Scanner.,webapp
bdfproxy,Patch Binaries via MITM: BackdoorFactory + mitmProxy,proxy
bdlogparser,"This is a utility to parse a Bit Defender log file, in order to sort them into a malware archive for easier maintenance of your malware collection.",malware
bed,"Collection of scripts to test for buffer overflows, format string vulnerabilities.",exploitation
beebug,A tool for checking exploitability.,decompiler
beef,The Browser Exploitation Framework that focuses on the web browser.,exploitation
beeswarm,Honeypot deployment made easy http://www.beeswarm-ids.org/,honeypot
beholder,A wireless intrusion detection tool that looks for anomalies in a wifi environment.,wireless
belati,The Traditional Swiss Army Knife for OSINT.,scanner
beleth,A Multi-threaded Dictionary based SSH cracker.,cracker
bettercap,Swiss army knife for network attacks and monitoring,sniffer
bettercap-ui,Official Bettercap's Web UI.,misc
bfac,An automated tool that checks for backup artifacts that may disclose the web-application's source code.,recon
bfbtester,Performs checks of single and multiple argument command line overflows and environment variable overflows,exploitation
bfuzz,Input based fuzzer tool for browsers.,fuzzer
bgp-md5crack,RFC2385 password cracker,cracker
bgrep,Binary grep.,binary
billcipher,Information Gathering tool for a Website or IP address.,recon
binaryninja-demo,A new kind of reversing platform (demo version).,reversing
binaryninja-python,Binary Ninja prototype written in Python.,binary
bind,"A complete, highly portable implementation of the DNS protocol",networking
bindead,A static analysis tool for binaries,binary
bindiff,"A comparison tool for binary files, that assists vulnerability researchers and engineers to quickly find differences and similarities in disassembled code.",binary
binex,Format String exploit building tool.,exploitation
binflow,POSIX function tracing. Much better and faster than ftrace.,binary
bing-ip2hosts,Enumerates all hostnames which Bing has indexed for a specific IP address.,recon
bing-lfi-rfi,Python script for searching Bing for sites that may have local and remote file inclusion vulnerabilities.,webapp
bingoo,A Linux bash based Bing and Google Dorking Tool.,scanner
binnavi,"A binary analysis IDE that allows to inspect, navigate, edit and annotate control flow graphs and call graphs of disassembled code.",disassembler
binproxy,A proxy for arbitrary TCP connections.,proxy
binwalk,A tool for searching a given binary image for embedded files,disassembler
binwally,Binary and Directory tree comparison tool using the Fuzzy Hashing concept (ssdeep).,binary
bios_memimage,A tool to dump RAM contents to disk (aka cold boot attack).,cracker
birp,A tool that will assist in the security assessment of mainframe applications served over TN3270.,scanner
bitdump,A tool to extract database data from a blind SQL injection vulnerability.,exploitation
bittwist,"A simple yet powerful libpcap-based Ethernet packet generator. It is designed to complement tcpdump, which by itself has done a great job at capturing network traffic.",sniffer
bkhive,Program for dumping the syskey bootkey from a Windows NT/2K/XP system hive.,cracker
blackbox-scanner,Dork scanner & bruteforcing & hash cracker with blackbox framework.,scanner
blackeye,"The most complete Phishing Tool, with 32 templates +1 customizable.",social
blackhash,Creates a filter from system hashes.,cracker
blacknurse,A low bandwidth ICMP attack that is capable of doing denial of service to well known firewalls.,dos
bleah,"A BLE scanner for ""smart"" devices hacking.",scanner
bless,"High-quality, full-featured hex editor",misc
bletchley,A collection of practical application cryptanalysis tools.,crypto
blind-sql-bitshifting,A blind SQL injection module that uses bitshfting to calculate characters.,exploitation
blindelephant,A web application fingerprinter. Attempts to discover the version of a (known) web application by comparing static files at known locations,fingerprint
blindsql,Set of bash scripts for blind SQL injection attacks.,database
blindy,Simple script to automate brutforcing blind sql injection vulnerabilities.,scanner
blisqy,Exploit Time-based blind-SQL injection in HTTP-Headers (MySQL/MariaDB).,webapp
bloodhound,Six Degrees of Domain Admin,recon
bloodhound-python,Bloodhound python data collector,recon
bluebox-ng,A GPL VoIP/UC vulnerability scanner.,voip
bluebugger,An implementation of the bluebug technique which was discovered by Martin Herfurt.,bluetooth
bluediving,A Bluetooth penetration testing suite.,bluetooth
bluefog,A tool that can generate an essentially unlimited number of phantom Bluetooth devices.,bluetooth
bluelog,"A Bluetooth scanner and sniffer written to do a single task, log devices that are in discoverable mode.",bluetooth
bluepot,"A Bluetooth Honeypot written in Java, it runs on Linux",bluetooth
blueprint,A perl tool to identify Bluetooth devices.,bluetooth
blueranger,A simple Bash script which uses Link Quality to locate Bluetooth device radios.,automation
bluescan,A Bluetooth Device Scanner.,bluetooth
bluesnarfer,A bluetooth attacking tool.,bluetooth
bluphish,Bluetooth device and service discovery tool that can be used for security assessment and penetration testing.,bluetooth
bluto,"Recon, Subdomain Bruting, Zone Transfers.",scanner
bmap-tools,Tool for copying largely sparse files using information from a block map file.,forensic
bmc-tools,RDP Bitmap Cache parser.,forensic
bob-the-butcher,A distributed password cracker package.,cracker
bof-detector,A simple detector of BOF vulnerabilities by source-code-level check.,code-audit
bonesi,The DDoS Botnet Simulator.,dos
boopsuite,A Suite of Tools written in Python for wireless auditing and security testing.,wireless
bopscrk,"Tool to generate smart wordlists, eg. based on lyrics.",automation
botb,A container analysis and exploitation tool for pentesters and engineers.,exploitation
bowcaster,A framework intended to aid those developing exploits.,exploitation
box-js,A tool for studying JavaScript malware.,malware
braa,A mass snmp scanner,scanner
braces,A Bluetooth Tracking Utility.,bluetooth
brakeman,A static analysis security vulnerability scanner for Ruby on Rails applications.,code-audit
brosec,An interactive reference tool to help security professionals utilize useful payloads and commands.,exploitation
browselist,"Retrieves the browse list ; the output list contains computer names, and the roles they play in the network.",windows
browser-fuzzer,Browser Fuzzer 3,fuzzer
brut3k1t,Brute-force attack that supports multiple protocols and services.,cracker
brute-force,Brute-Force attack tool for Gmail Hotmail Twitter Facebook Netflix.,cracker
brute12,A tool designed for auditing the cryptography container security in PKCS12 format.,windows
bruteforce-luks,Try to find the password of a LUKS encrypted volume.,cracker
bruteforce-salted-openssl,Try to find the password of a file that was encrypted with the 'openssl' command.,cracker
bruteforce-wallet,"Try to find the password of an encrypted Peercoin (or Bitcoin,Litecoin, etc...) wallet file.",cracker
brutemap,Penetration testing tool that automates testing accounts to the site's login page.,webapp
brutespray,Brute-Forcing from Nmap output - Automatically attempts default creds on found services.,automation
brutessh,"A simple sshd password bruteforcer using a wordlist, it's very fast for internal networks. It's multithreads.",cracker
brutex,Automatically brute force all services running on a target.,automation
brutexss,Cross-Site Scripting Bruteforcer.,webapp
brutus,"One of the fastest, most flexible remote password crackers you can get your hands on.",windows
bsdiff,bsdiff and bspatch are tools for building and applying patches to binary files.,reversing
bsqlbf,Blind SQL Injection Brute Forcer.,webapp
bsqlinjector,Blind SQL injection exploitation tool written in ruby.,webapp
bss,Bluetooth stack smasher / fuzzer,bluetooth
bt_audit,Bluetooth audit,bluetooth
btcrack,The world's first Bluetooth Pass phrase (PIN) bruteforce tool. Bruteforces the Passkey and the Link key from captured Pairing exchanges.,bluetooth
btlejack,Bluetooth Low Energy Swiss-army knife.,bluetooth
btproxy-mitm,Man in the Middle analysis tool for Bluetooth.,bluetooth
btscanner,Bluetooth device scanner.,bluetooth
bulk-extractor,Bulk Email and URL extraction tool.,forensic
bully,Retrieve WPA/WPA2 passphrase from a WPS enabled access point,wireless
bunny,"A closed loop, high-performance, general purpose protocol-blind fuzzer for C programs.",fuzzer
burpsuite,An integrated platform for attacking web applications (community edition) + SHELLING plugin.,fuzzer
buster,Find emails of a person and return info associated with them.,social
buttinsky,Provide an open source framework for automated botnet monitoring.,networking
bvi,"A display-oriented editor for binary files operate like ""vi"" editor.",binary
byepass,Automates password cracking tasks using optimized dictionaries and mangling rules.,automation
bypass-firewall-dns-history,Firewall bypass script based on DNS history records.,networking
bytecode-viewer,A Java 8/Android APK Reverse Engineering Suite.,binary
c5scan,Vulnerability scanner and information gatherer for the Concrete5 CMS.,webapp
cachedump,A tool that demonstrates how to recover cache entry information: username and hashed password (called MSCASH).,windows
cadaver,Command-line WebDAV client for Unix,networking
cafebabe,Java bytecode editor & decompiler.,decompiler
cameradar,Hacks its way into RTSP videosurveillance cameras.,scanner
camscan,A tool which will analyze the CAM table of Cisco switches to look for anamolies.,scanner
can-utils,Linux-CAN / SocketCAN user space applications.,automobile
canalyzat0r,Security analysis toolkit for proprietary car protocols.,automobile
canari,Maltego rapid transform development and execution framework.,forensic
cangibrina,Dashboard Finder.,scanner
cansina,A python-based Web Content Discovery Tool.,webapp
cantoolz,Framework for black-box CAN network analysis.,automobile
capfuzz,"Capture, fuzz and intercept web traffic.",sniffer
capstone,"Lightweight multi-platform, multi-architecture disassembly framework",reversing
captipper,Malicious HTTP traffic explorer tool.,forensic
cardpwn,OSINT Tool to find Breached Credit Cards Information.,social
carwhisperer,Intends to sensibilise manufacturers of carkits and other Bluetooth appliances without display and keyboard for the possible security threat evolving from the use of standard passkeys.,bluetooth
casefile,"The little brother to Maltego without transforms, but combines graph and link analysis to examine links between manually added data to mind map your information",forensic
catnthecanary,An application to query the canary.pw data set for leaked data.,recon
catphish,For phishing and corporate espionage.,social
ccrawldns,Retrieves from the CommonCrawl data set unique subdomains for a given domain name.,recon
cdpsnarf,Cisco discovery protocol sniffer.,sniffer
cecster,A tool to perform security testing against the HDMI CEC (Consumer Electronics Control) and HEC (HDMI Ethernet Channel) protocols.,scanner
centry,Cold boot & DMA protection,misc
certgraph,Crawl the graph of certificate Alternate Names.,recon
cewl,A custom word list generator.,automation
cflow,A C program flow analyzer.,code-audit
cfr,Another Java decompiler.,decompiler
chameleon,A tool for evading Proxy categorisation.,networking
chameleonmini,"Official repository of ChameleonMini, a freely programmable, portable tool for NFC security analysis that can emulate and clone contactless cards, read RFID tags and sniff/log RF data.",social
changeme,A default credential scanner.,scanner
chankro,Tool that generates a PHP capable of run a custom binary (like a meterpreter) or a bash script (p.e. reverse shell) bypassing disable_functions & open_basedir).,webapp
chaos-client,Go client to communicate with Chaos dataset API.,recon
chaosmap,An information gathering tool and dns / whois / web server scanner,forensic
chaosreader,"A freeware tool to trace tcp, udp etc. sessions and fetch application data from snoop or tcpdump logs.",networking
chapcrack,A tool for parsing and decrypting MS-CHAPv2 network handshakes.,cracker
cheat-sh,The only cheat sheet you need.,automation
check-weak-dh-ssh,Debian OpenSSL weak client Diffie-Hellman Exchange checker.,scanner
checkiban,Checks the validity of an International Bank Account Number (IBAN).,misc
checkpwd,Oracle Password Checker (Cracker).,cracker
checksec,Tool designed to test which standard Linux OS and PaX security features are being used,automation
chiasm-shell,"Python-based interactive assembler/disassembler CLI, powered byKeystone/Capstone.",disassembler
chipsec,Platform Security Assessment Framework.,hardware
chiron,An all-in-one IPv6 Penetration Testing Framework.,scanner
